{"canonicalPackSha256":"402a6335533cb532a68ffc3ec52de332f926610fa10214237b03f054e58e3231","expectedFindingsSha256":"deabac540e8071bf3d54139b79282a23665d114baec76e99989ab60f033c3d8e","fixtureManifestSha256":"4134989138f7ff562af55f58d32dd806e361982db7173e8bb933a2108a9e7eab","incidentId":"CIR-REVIEWDOG-ACTION-SETUP-2025","originalPackSha256":"05a4b33576f222a2a5a31e24e928f837774e2eec2cd84c88bec3205cf1e47efe","packVersion":"1.0.0","result":"pass","schemaVersion":"cirewind.review-validation/v1alpha1","validatorPolicySha256":"ddb2aff301c8d55ad8383701ddf4cb7961973689fe1413a19f127b2f7faf47aa","validatorVersion":"incident-validator-v1alpha1.1"}
