{"canonicalPackSha256":"0a5493027fe3f7b7eb81e1aa2d3fc0e5d1e16e62e765929f9d7ff827ea79c2c3","expectedFindingsSha256":"779b89f9949737bddeb8d7aadc782d33893adb1f8038a108074ae628d6cc05c1","fixtureManifestSha256":"4aa8f82869f30c22b1b78f729a2fa9a15eefcd7a0b4502eb5945bf5865bc08ae","incidentId":"CIR-TJ-ACTIONS-CHANGED-FILES-2025","originalPackSha256":"783c61a0f734c4bc6dd1564c32cf8b5081e1db7248fe1a31b2b57886b544809b","packVersion":"1.0.0","result":"pass","schemaVersion":"cirewind.review-validation/v1alpha1","validatorPolicySha256":"ddb2aff301c8d55ad8383701ddf4cb7961973689fe1413a19f127b2f7faf47aa","validatorVersion":"incident-validator-v1alpha1.1"}
