{"canonicalPackSha256":"9cdbb2f0a06f813926dfdb75976e067eabfa3d2aabdc46c94e88b262a61d95cf","expectedFindingsSha256":"fbe293c183939078efd40abc791f2bf58ad4cf9575ffe2325dc19d353e536892","fixtureManifestSha256":"dd31103d974108404b715d193dad16d53d5eb2cf2661b38eeef55d05f4e48fc8","incidentId":"CIR-AQUASECURITY-TRIVY-2026","originalPackSha256":"c758e368cb74c832c03b875dbcf3211122cf38b62f6589aa58b9db1331eac6f8","packVersion":"1.0.0","result":"pass","schemaVersion":"cirewind.review-validation/v1alpha1","validatorPolicySha256":"ddb2aff301c8d55ad8383701ddf4cb7961973689fe1413a19f127b2f7faf47aa","validatorVersion":"incident-validator-v1alpha1.1"}
